<?xml version="1.0" encoding="UTF-8"?>

<carDealership noNamespaceSchemaLocation="carDealership.xsd">
	<users>
		<user>
			<userId>0</userId>
			<name>John</name>
		</user>
		<user>
			<userId>1</userId>
			<name>Jane</name>
		</user>
	</users>
	<payments>
		<payment>
			<paymentId>0</paymentId>
			<amount>-15.00</amount>
			<userId>0</userId>
		</payment>
		<payment>
			<paymentId>0</paymentId>
			<amount>-15.00</amount>
			<userId>0</userId>
		</payment>
	</payments>
	
	<employees>
		<employee>
			<employeeId>0</employeeId>
			<wage>15.00</wage>
			<title>Janitor</title>
			<userId>0</userId>
		</employee>
		<employee>
			<employeeId>0</employeeId>
			<wage>15.00</wage>
			<title>Janitor</title>
			<userId>0</userId>
		</employee>
	</employees>
	
	<customers>
		<customer>
			<customerId>0</customerId>
			<userId>0</userId>
		</customer>
		<customer>
			<customerId>0</customerId>
			<userId>0</userId>
		</customer>
	</customers>
	<vehicleSales>
		<vehicleSale>
			<saleId>0</saleId>
			<customerId>0</customerId>
			<vehicleId>0</vehicleId>
			<discount>10%</discount>
			<total>500.00</total>
		</vehicleSale>
		<vehicleSale>
			<saleId>0</saleId>
			<customerId>0</customerId>
			<vehicleId>0</vehicleId>
			<discount>10%</discount>
			<total>500.00</total>
		</vehicleSale>
	</vehicleSales>

	<serviceProviders>
		<serviceProvider>
			<serviceProviderId>0</serviceProviderId>
			<userId></userId>
		</serviceProvider>
		<serviceProvider>
			<serviceProviderId>0</serviceProviderId>
			<userId></userId>
		</serviceProvider>
	</serviceProviders>
	<vehicleServices>
		<vehicleService>
			<serviceId>0</serviceId>
			<serviceProviderId></serviceProviderId>
		</vehicleService>
		<vehicleService>
			<serviceId>0</serviceId>
			<serviceProviderId></serviceProviderId>
		</vehicleService>
	</vehicleServices>
	
	<vendors>
		<vendor>
			<vendorId>0</vendorId>
			<userId>0</userId>
		</vendor>
		<vendor>
			<vendorId>0</vendorId>
			<userId>0</userId>
		</vendor>
	</vendors>
	<vehiclePurchases>
		<vehiclePurchase>
			<purchaseId>0</purchaseId>
			<vehicleId>0</vehicleId>
			<vendorId>0</vendorId>
			<cost>100.00</cost>
		</vehiclePurchase>
		<vehiclePurchase>
			<purchaseId>0</purchaseId>
			<vehicleId>0</vehicleId>
			<vendorId>0</vendorId>
			<cost>100.00</cost>
		</vehiclePurchase>
	</vehiclePurchases>
	<vehiclePartPurchases>
		<vehcilePartPurchase>
			<vehiclePartPurchaseId>0</vehiclePartPurchaseId>
			<vendorId>0</vendorId>
			<partId>0</partId>
		</vehcilePartPurchase>
		<vehcilePartPurchase>
			<vehiclePartPurchaseId>0</vehiclePartPurchaseId>
			<vendorId>0</vendorId>
			<partId>0</partId>
		</vehcilePartPurchase>
	</vehiclePartPurchases>
	<vehicleParts>
		<vehiclePart>
			<partId>0</partId>
			<partTypeId>0</partTypeId>
		</vehiclePart>
		<vehiclePart>
			<partId>0</partId>
			<partTypeId>0</partTypeId>
		</vehiclePart>
	</vehicleParts>
	<partTypes>
		<partType>
			<partTypeId>0</partTypeId>
			<name>Engine</name>
			<price>100.00</price>
		</partType>
		<partType>
			<partTypeId>0</partTypeId>
			<name>Engine</name>
			<price>100.00</price>
		</partType>
	</partTypes>
	
	<vehicles>
		<vehicle>
			<vehicleId>0</vehicleId>
			<year>2000</year>
			<modelId>0</modelId>
			<colorId>0</colorId>
			<price>100.00</price>
		</vehicle>
		<vehicle>
			<vehicleId>0</vehicleId>
			<year>2000</year>
			<modelId>0</modelId>
			<colorId>0</colorId>
			<price>100.00</price>
		</vehicle>
	</vehicles>
	<colors>
		<color>
			<colorId>0</colorId>
			<name>Blue</name>
		</color>
		<color>
			<colorId>0</colorId>
			<name>Blue</name>
		</color>
	</colors>
	<models>
		<model>
			<modelId>0</modelId>
			<name>Fiesta</name>
			<brand>Ford</brand>
			<vehicletypeId>0</vehicletypeId>
		</model>
		<model>
			<modelId>0</modelId>
			<name>Fiesta</name>
			<brand>Ford</brand>
			<vehicletypeId>0</vehicletypeId>
		</model>
	</models>
	<vehicleTypes>
		<vehicleType>
			<typeId>0</typeId>
			<name>Sedan</name>
		</vehicleType>
		<vehicleType>
			<typeId>0</typeId>
			<name>Sedan</name>
		</vehicleType>
	</vehicleTypes>
	<brands>
		<brand>
			<brandId>0</brandId>
			<name>Ford</name>
		</brand>
		<brand>
			<brandId>0</brandId>
			<name>Ford</name>
		</brand>
	</brands>
</carDealership>